{"contract":"CASFJHI5PQSRWS7JV25CF7FOMRKIVBP3RXRP3E2GH2CV4BCAG7FUJRCN","function":"claim","args":{"handle":"uiwritefixture","wallet":"GAAZI4TCR3TY5OJHCTJC2A4QSY6CJWJH5IAJTGKIN2ER7LBNVKOCCWN7"},"network":"testnet","forkId":"CASFJHI5PQSRWS7JV25CF7FOMRKIVBP3RXRP3E2GH2CV4BCAG7FUJRCN@5388497","forkLedger":5388497,"protocol":29,"outcome":"result","returnValue":null,"returnValueXdr":"AAAAAQ==","events":[{"type":"contract","event_xdr":"AAAAAAAAAAEkVJ0dfCUbS+muuiL8rmRUioX7jeL9k0Y+hV4EQDfLRAAAAAEAAAAAAAAAAgAAAA8AAAAHY2xhaW1lZAAAAAAOAAAADnVpd3JpdGVmaXh0dXJlAAAAAAASAAAAAAAAAAABlHJijueOuScU0i0DkJY8JNkn6gCZmUhuiR+sLaqcIQ==","decoded":{"contract_id":"CASFJHI5PQSRWS7JV25CF7FOMRKIVBP3RXRP3E2GH2CV4BCAG7FUJRCN","data":"GAAZI4TCR3TY5OJHCTJC2A4QSY6CJWJH5IAJTGKIN2ER7LBNVKOCCWN7","name":null,"topics":["claimed","uiwritefixture"],"type":"contract"}}],"auth":["AAAAAQAAAAAAAAAAAZRyYo7njrknFNItA5CWPCTZJ+oAmZlIbokfrC2qnCFETbFscITvlwAAAAAAAAABAAAAAAAAAAEkVJ0dfCUbS+muuiL8rmRUioX7jeL9k0Y+hV4EQDfLRAAAAAVjbGFpbQAAAAAAAAIAAAAOAAAADnVpd3JpdGVmaXh0dXJlAAAAAAASAAAAAAAAAAABlHJijueOuScU0i0DkJY8JNkn6gCZmUhuiR+sLaqcIQAAAAA="],"authEntries":[{"credentials":"address","address":"GAAZI4TCR3TY5OJHCTJC2A4QSY6CJWJH5IAJTGKIN2ER7LBNVKOCCWN7","root_function":{"kind":"contract_fn","contract_id":"CASFJHI5PQSRWS7JV25CF7FOMRKIVBP3RXRP3E2GH2CV4BCAG7FUJRCN","function":"claim"},"sub_invocations":0}],"modifiedEntries":[{"key_xdr":"AAAABgAAAAAAAAAAAZRyYo7njrknFNItA5CWPCTZJ+oAmZlIbokfrC2qnCEAAAAVRE2xbHCE75cAAAAA","before_xdr":null,"after_xdr":"AAAAAAAAAAYAAAAAAAAAAAAAAAABlHJijueOuScU0i0DkJY8JNkn6gCZmUhuiR+sLaqcIQAAABVETbFscITvlwAAAAAAAAABAAAAAA==","live_until_ledger":5389216},{"key_xdr":"AAAABgAAAAEkVJ0dfCUbS+muuiL8rmRUioX7jeL9k0Y+hV4EQDfLRAAAABAAAAABAAAAAgAAAA8AAAAFT3duZXIAAAAAAAAOAAAADnVpd3JpdGVmaXh0dXJlAAAAAAAB","before_xdr":null,"after_xdr":"AAAAAAAAAAYAAAAAAAAAASRUnR18JRtL6a66IvyuZFSKhfuN4v2TRj6FXgRAN8tEAAAAEAAAAAEAAAACAAAADwAAAAVPd25lcgAAAAAAAA4AAAAOdWl3cml0ZWZpeHR1cmUAAAAAAAEAAAASAAAAAAAAAAABlHJijueOuScU0i0DkJY8JNkn6gCZmUhuiR+sLaqcIQAAAAA=","live_until_ledger":5509456},{"key_xdr":"AAAABgAAAAEkVJ0dfCUbS+muuiL8rmRUioX7jeL9k0Y+hV4EQDfLRAAAABAAAAABAAAAAgAAAA8AAAAGSGFuZGxlAAAAAAASAAAAAAAAAAABlHJijueOuScU0i0DkJY8JNkn6gCZmUhuiR+sLaqcIQAAAAE=","before_xdr":null,"after_xdr":"AAAAAAAAAAYAAAAAAAAAASRUnR18JRtL6a66IvyuZFSKhfuN4v2TRj6FXgRAN8tEAAAAEAAAAAEAAAACAAAADwAAAAZIYW5kbGUAAAAAABIAAAAAAAAAAAGUcmKO5465JxTSLQOQljwk2SfqAJmZSG6JH6wtqpwhAAAAAQAAAA4AAAAOdWl3cml0ZWZpeHR1cmUAAAAAAAA=","live_until_ledger":5509456},{"key_xdr":"AAAABgAAAAEkVJ0dfCUbS+muuiL8rmRUioX7jeL9k0Y+hV4EQDfLRAAAABQAAAAB","before_xdr":"AFFVoQAAAAYAAAAAAAAAASRUnR18JRtL6a66IvyuZFSKhfuN4v2TRj6FXgRAN8tEAAAAFAAAAAEAAAATAAAAAJNplsdLfTg8VuwXSFexWSfN0pR4xpCdozK03si2czX+AAAAAQAAAAIAAAAQAAAAAQAAAAEAAAAPAAAABUFkbWluAAAAAAAAEgAAAAAAAAAAvYQ0HSj6xdEcWoXE4R0CgW+GJUxU0lNzrHNsNw3alZQAAAAQAAAAAQAAAAEAAAAPAAAABUNvdW50AAAAAAAAAwAAAAMAAAAA","after_xdr":"AFFVoQAAAAYAAAAAAAAAASRUnR18JRtL6a66IvyuZFSKhfuN4v2TRj6FXgRAN8tEAAAAFAAAAAEAAAATAAAAAJNplsdLfTg8VuwXSFexWSfN0pR4xpCdozK03si2czX+AAAAAQAAAAIAAAAQAAAAAQAAAAEAAAAPAAAABUFkbWluAAAAAAAAEgAAAAAAAAAAvYQ0HSj6xdEcWoXE4R0CgW+GJUxU0lNzrHNsNw3alZQAAAAQAAAAAQAAAAEAAAAPAAAABUNvdW50AAAAAAAAAwAAAAQAAAAA","live_until_ledger":5451132}],"resources":{"instructions":1121692,"disk_read_bytes":144,"write_bytes":596,"footprint":{"read_only":["AAAAAAAAAAABlHJijueOuScU0i0DkJY8JNkn6gCZmUhuiR+sLaqcIQ==","AAAAB5NplsdLfTg8VuwXSFexWSfN0pR4xpCdozK03si2czX+"],"read_write":["AAAABgAAAAAAAAAAAZRyYo7njrknFNItA5CWPCTZJ+oAmZlIbokfrC2qnCEAAAAVRE2xbHCE75cAAAAA","AAAABgAAAAEkVJ0dfCUbS+muuiL8rmRUioX7jeL9k0Y+hV4EQDfLRAAAABAAAAABAAAAAgAAAA8AAAAGSGFuZGxlAAAAAAASAAAAAAAAAAABlHJijueOuScU0i0DkJY8JNkn6gCZmUhuiR+sLaqcIQAAAAE=","AAAABgAAAAEkVJ0dfCUbS+muuiL8rmRUioX7jeL9k0Y+hV4EQDfLRAAAABAAAAABAAAAAgAAAA8AAAAFT3duZXIAAAAAAAAOAAAADnVpd3JpdGVmaXh0dXJlAAAAAAAB","AAAABgAAAAEkVJ0dfCUbS+muuiL8rmRUioX7jeL9k0Y+hV4EQDfLRAAAABQAAAAB"]}},"fee":{"resource_fee":141412},"cost":{"cpu_insns":1121692,"mem_bytes":1222193},"misses":["AAAAAAAAAAABlHJijueOuScU0i0DkJY8JNkn6gCZmUhuiR+sLaqcIQ==","AAAABgAAAAAAAAAAAZRyYo7njrknFNItA5CWPCTZJ+oAmZlIbokfrC2qnCEAAAAVRE2xbHCE75cAAAAA","AAAABgAAAAEkVJ0dfCUbS+muuiL8rmRUioX7jeL9k0Y+hV4EQDfLRAAAABAAAAABAAAAAgAAAA8AAAAFT3duZXIAAAAAAAAOAAAADnVpd3JpdGVmaXh0dXJlAAAAAAAB","AAAABgAAAAEkVJ0dfCUbS+muuiL8rmRUioX7jeL9k0Y+hV4EQDfLRAAAABAAAAABAAAAAgAAAA8AAAAGSGFuZGxlAAAAAAASAAAAAAAAAAABlHJijueOuScU0i0DkJY8JNkn6gCZmUhuiR+sLaqcIQAAAAE=","AAAABgAAAAEkVJ0dfCUbS+muuiL8rmRUioX7jeL9k0Y+hV4EQDfLRAAAABQAAAAB","AAAAB5NplsdLfTg8VuwXSFexWSfN0pR4xpCdozK03si2czX+"],"drift":{"forkLedger":5388497,"newestLedger":0,"keys":[]},"seed":"af5570f5a1810b7af78caf4bc70a660f0df51e42baf91d4de5b2328de0e83dfc","forkTime":"2026-10-25T22:07:52Z","authMode":"record","ledger":{"sequence":5388497,"timestamp":1792966072,"protocol":29},"contracts":[]}
