{"contract":"CASFJHI5PQSRWS7JV25CF7FOMRKIVBP3RXRP3E2GH2CV4BCAG7FUJRCN","function":"count","args":{},"network":"testnet","forkId":"CASFJHI5PQSRWS7JV25CF7FOMRKIVBP3RXRP3E2GH2CV4BCAG7FUJRCN@5388497","forkLedger":5388497,"protocol":29,"outcome":"result","returnValue":3,"returnValueXdr":"AAAAAwAAAAM=","events":[],"auth":[],"authEntries":[],"modifiedEntries":[],"resources":{"instructions":371738,"disk_read_bytes":0,"write_bytes":0,"footprint":{"read_only":["AAAABgAAAAEkVJ0dfCUbS+muuiL8rmRUioX7jeL9k0Y+hV4EQDfLRAAAABQAAAAB","AAAAB5NplsdLfTg8VuwXSFexWSfN0pR4xpCdozK03si2czX+"],"read_write":[]}},"fee":{"resource_fee":5191},"cost":{"cpu_insns":371738,"mem_bytes":1211208},"misses":["AAAABgAAAAEkVJ0dfCUbS+muuiL8rmRUioX7jeL9k0Y+hV4EQDfLRAAAABQAAAAB","AAAAB5NplsdLfTg8VuwXSFexWSfN0pR4xpCdozK03si2czX+"],"drift":{"forkLedger":5388497,"newestLedger":0,"keys":[]},"seed":"af5570f5a1810b7af78caf4bc70a660f0df51e42baf91d4de5b2328de0e83dfc","forkTime":"2026-10-25T22:07:52Z","authMode":"record","ledger":{"sequence":5388497,"timestamp":1792966072,"protocol":29},"contracts":[]}
